"為鼓勵具指標性廠商掌握關鍵技術/產品,以建構完整供應鏈體系,或引導企業建立整體系統解決方案供應者能量,以擴大整廠整案海外輸出,爭取國際商機,經濟部與科技部共同推動「產業升級創新平台輔導計畫」,並依據「經濟部協助產業創新活動補助獎勵及輔導辦法」(以下簡稱本辦法),訂定「產業升級創新平台輔導計畫申請須知(創新優化計畫)」(以下簡稱本須知),以補助方式協助廠商開發關鍵設備、材料及零組件,提供跨領域系統整合,發展整體解決方案。有關計畫申請及後續簽約管考等相關行政作業,依行政程序由經濟部工業局(以下簡稱本部),委託財團法人台灣中小企業聯合輔導基金會(以下簡稱聯輔基金會)成立之「經濟部工業局產業升級創新平台計畫專案辦公室」(以下簡稱計畫專案辦公室)協助推動,並配合計畫申請及審查需要,將相關作業規定及應備資料彙編成冊,俾利業界參考運用。"
"創新優化計畫申請資格：本計畫可由單一企業或多家企業聯合提出申請;或可由企業與學術機構或法人機構共同提出申請。如為 2 家以上(含學術機構或法人機構)之聯合提案,須由其中一家企業擔任主導單位提出申請(主導單位僅限企業)。一、企業:(一) 國內依法登記成立之獨資、合夥、有限合夥事業或公司。註 1(二) 非屬銀行拒絕往來戶,且淨值(股東權益)為正值。註 2(三) 不得為陸資投資企業(依經濟部投資審議委員會公布之最新陸資來台投資事業名錄)。註1:分公司屬總公司管轄之分支機構,不具獨立之法人格,不符申請資格。註2:企業淨值之認定,以申請時最近一年度會計師財務簽證之查核報告書為準;無會計師簽證之查核報告書,則以營利事業所得稅結算申報書之財務報表為準。企業於計畫申請當年度始登記成立者,得以企業設立登記資本額查核報告書,以及最近一期會計師期中查核/核閱報告或申請前一個月之自編財務報表代替。如企業淨值原為負數,但於計畫申請前因辦理增資,應檢附「資本額查核報告書」及增資後資產負債表及損益表(會計師簽證),期中財務報表已轉為正值,視同符合申請資格。"
"創新優化計畫申請資格：本計畫可由單一企業或多家企業聯合提出申請;或可由企業與學術機構或法人機構共同提出申請。如為 2 家以上(含學術機構或法人機構)之聯合提案,須由其中一家企業擔任主導單位提出申請(主導單位僅限企業)。二、學界:(一) 公私立大專校院、公立研究機構。(二) 計畫主持人及共同主持人:係指符合科技部補助專題研究計畫作業要點第三點規定。"
"創新優化計畫申請資格：本計畫可由單一企業或多家企業聯合提出申請;或可由企業與學術機構或法人機構共同提出申請。如為 2 家以上(含學術機構或法人機構)之聯合提案,須由其中一家企業擔任主導單位提出申請(主導單位僅限企業)。三、法人:以「本部評鑑之財團法人」為限。"
"創新優化計畫範疇：一、申請產業升級創新平台輔導計畫(創新優化計畫)之產品或整體系統服務須具備市場潛力。二、開發產品者(如材料、零組件及設備等),其關鍵技術可超越目前國內產業技術水準,並可帶動上中下游廠商發展,提升自主能力,補足產業價值鏈缺口。三、開發整體系統解決方案者,應可以一產品一聯盟方式建立旗艦團隊,結合工程、產品、經驗、知識、服務及技術加值等,提供整廠整案輸出之開發,運用新服務商品、新經營模式與商業應用技術,整合業務行銷、前台服務與後台管理、通路佈建及顧客關係管理等,建立快速且有效滿足顧客之服務系統。"
"創新優化計畫應備申請資料：一、計畫申請表及申請企業基本資料表 一式 2 份。二、計畫書一式 2 份。註 1三、最近 3 年會計師簽證之查核報告書(若為影本須加蓋企業大小章)註 2 註 3。四、屬申請台法創新合作機制之企業,須另檢附台法創新合作申請表註 4。註1:待資格文件檢查通過後,依通知再送計畫書電子檔。註2:主導企業須檢具最近3年、聯合申請企業須檢具最近1年之會計師簽證之查核報告書(若為關係企業,請檢附申請企業之個體財務報告暨會計師查核報告書)。若無會計師財務簽證之查核報告書,則須檢具營利事業所得稅結算申報書之財務報表。註3:企業於計畫申請當年度始登記成立者,得以企業設立登記資本額查核報告書,以及最近一期會計師期中查核/核閱報告或申請前一個月之自編財務報表代替。註4:台法創新合作申請表詳如本須知附件十一,內容需以英文填寫。註5:所送資料,無論審查通過與否或自行撤案,均不另發還。"
創新優化計畫各階段審查原則：一、資格初審:由工業局委託之法人或團體檢視申請資格、各項應備資料、計畫書格式及所附文件與經費編列等是否符合規定。
"創新優化計畫各階段審查原則：二、計畫內容初審審查項目(一) 申請企業研發實績與執行計畫之研發能力。(二) 計畫內涵是否掌握關鍵技術/產品,建構完整供應鏈體系,或引導業者建立整體系統解決方案供應者能量,以擴大整廠整案海外輸出,爭取國際商機。(三) 計畫內容屬補關鍵者,開發之關鍵技術、零組件及設備需具備超越目前國內產業技術水準,並可帶動上中下游廠商發展,補足產業價值鏈缺口,達成自主能力提升的目標。(四) 計畫內容屬展系統者,應包含整體系統服務及商業營運模式(TotalSolution) 、系統可行性驗證、國內場域試煉規劃及導入(試營運)。其服務內涵應以一產品一聯盟方式建立旗艦團隊,結合工程、產品、經驗、知識、服務及技術加值等,打造整體系統解決方案(TotalSolution) ,提供整廠整案輸出之開發能力,運用新服務商品、新經營模式與商業應用技術,整合業務行銷、前台服務與後台管理、通路佈建及顧客關係管理等,建立更快速及更有效滿足顧客之服務系統。"
創新優化計畫各階段審查原則：二、計畫內容初審審查項目(五) 委託研究及無形資產引進之內容與對象之必要性與合理性。(六) 計畫時程、實施方式、技術指標、研發項目、競爭分析及預期效益與研發經費編列之合理性等。(七) 多家企業(含學術或法人機構)申請計畫之整合能力。
"創新優化計畫各階段審查原則：三、計畫核定審查:本部審議會為初審結果之審議會議(一) 審議各階段初審審查項目及結果。(二) 審議核定補助款金額及比例。(三) 依審議結果,函知本部或本部所屬機關(或受本部或本部所屬機關所委託之法人或團體)函知申請單位。"